paragraph_id,text,source,vector
590,"Les Ideen II mettent au jour, sous la « chose matérielle objective », un lacis
d'implications où l'on ne sent plus la pulsation de la conscience constituante. Entre
les mouvements de mon corps, et les « propriétés » de la chose [210] qu'ils révè-
lent, le rapport est celui du « je peux » aux merveilles qu'il est en son pouvoir de
susciter. Il faut bien pourtant que mon corps soit engrené lui-même sur le monde
visible : son pouvoir, il le tient justement de ce qu'il a une place d’où il voit. C'est
donc une chose, mais une chose où je réside. Il est, si l'on veut, du côté du sujet,
mais n'est pas étranger à la localité des choses : entre lui et elles, le rapport est
celui de l'ici absolu au là, de l'origine des distances à la distance. Il est le champ
où mes pouvoirs perceptifs se sont localisés. Mais quel est donc le lien entre eux
et lui, si ce n'est pas la co-variation objective ? Si une conscience, dit Husserl,
éprouvait de la satiété quand le réservoir d'eau d'une locomotive est plein, et de la
chaleur chaque fois que le foyer est allumé, la locomotive ne serait pas pour au-
tant le corps de cette conscience 89 . Qu’y a-t-il donc de plus, entre mon corps et
moi, que les régularités de la causalité occasionnelle ? Il y a un rapport de mon
corps à lui-même qui fait de lui le vinculum du moi et des choses. Quand ma main
droite touche ma main gauche, je la sens comme une « chose physique », mais au
même moment, si je veux, un événement extraordinaire se produit : voici que ma
main gauche aussi se met à sentir ma main droite, es wird Leib, es empfindet 90 .",signes.txt,
591,"La chose physique s’anime, - ou plus exactement elle reste ce qu'elle était, l'évé-
nement ne l’enrichit pas, mais une puissance exploratrice vient se poser sur elle
ou l'habiter. Donc je me touche touchant, mon corps accomplit « une sorte de ré-
flexion ». En lui, par lui, il n'y a pas seulement rapport à sens unique de celui qui
sent à ce qu'il sent : le rapport se renverse, la main touchée devient touchante, et
je suis obligé de dire que le toucher ici est répandu dans le corps, que le corps est
« chose sentante », « sujet-objet » 91 .",signes.txt,
592,"Il faut bien voir que cette description bouleverse aussi notre idée de la chose et
du monde, et qu'elle aboutit à une réhabilitation ontologique du sensible. Car dé-

89   Ideen III, Beilage I, p. 117.",signes.txt,
593,"90   Ideen II, p. 145.",signes.txt,
594,"91   Ibid., p. 119 : « Empfindendes Ding. » Ibid., p. 124 : « Das subjektive Objekt. »
                                                   Maurice Merleau-Ponty, SIGNES. (1960)     166




sormais on peut dire à la lettre que l'espace lui-même se sait à [211] travers mon
corps. Si la distinction du sujet et de l’objet est brouillée dans mon corps (et sans
doute celle de la noèse et du noème ?), elle l'est aussi dans la chose, qui est le pôle
des opérations de mon corps, le terme où finit son exploration 92 , prise donc dans
le même tissu intentionnel que lui. Quand on dit que la chose perçue est saisie
« en personne » ou « dans sa chair » (leibhaft), cela est à prendre à la lettre : la
chair du sensible, ce grain serré qui arrête l'exploration, cet optimum qui la termi-
ne reflètent ma propre incarnation et en sont la contrepartie. Il y a là un genre de
l'être, un univers avec son « sujet » et son « objet » sans pareils, l'articulation de
l'un sur l'autre et la définition une fois pour toutes d'un « irrélatif » de toutes les
« relativités » de l'expérience sensible, qui est « fondement de droit » pour toutes
les constructions de la connaissance 93 . Toute la connaissance, toute la pensée
objective vivent de ce fait inaugural que j'ai senti, que j'ai eu, avec cette couleur
ou quel que soit le sensible en cause, une existence singulière qui arrêtait d'un
coup mon regard, et pourtant lui promettait une série d'expériences indéfinie,
concrétion de possibles d'ores et déjà réels dans les côtés cachés de la chose, laps
de durée donné en une fois. L'intentionnalité qui relie les moments de mon explo-
ration, les aspects de la chose, et les deux séries l'une à l'autre, ce n'est pas l'activi-
té de liaison du sujet spirituel, ni les pures connexions de l'objet, c'est la transition
que j'effectue comme sujet charnel d'une phase du mouvement à l'autre, toujours
possible pour moi par principe parce que je suis cet animal de perceptions et de
mouvements qui s'appelle un corps. Certes, il y a là un problème : que sera donc
l'intentionnalité si elle n'est plus la saisie par l'esprit d'une matière sensible comme
exemplaire d'une essence, la récognition dans les choses de ce que nous y avons
mis ? Elle ne peut pas davantage être le fonctionnement subi d'une préordination
ou d'une téléologie transcendantes, ou, au sens cartésien, d'une « institution de la
nature » qui opère en nous sans nous : ce serait, au moment [212] où nous venons
de l'en distinguer, réintégrer l'ordre du sensible au monde des projets objectifs ou
des plans, - ce serait oublier qu'il est l'être à distance, l'attestation fulgurante ici et
maintenant d'une richesse inépuisable, que les choses ne sont qu'entrouvertes de-
vant nous, dévoilées et cachées : de tout cela, on rend compte aussi mal en faisant
du monde une fin qu'en le faisant idée. La solution, - si solution il y a, - ne peut
être que d'interroger cette couche du sensible, ou de nous apprivoiser à ses énig-
mes.",signes.txt,
595,"Nous sommes encore loin des blosze Sachen cartésiennes. La chose pour mon
corps, c'est la chose « solipsiste », ce n'est pas encore la chose même. Elle est

92    Ideen 11, p. 60 : « Die Erfahrungstendenz terminiert in ihr, erfüllt sich in ilir. »
93    Ibid., p. 76 : « Rechtsgrund. »
                                             Maurice Merleau-Ponty, SIGNES. (1960)   167




prise dans le contexte de mon corps, qui lui-même n'appartient à l'ordre des cho-
ses que par sa frange ou sa périphérie. Le monde ne s'est pas encore refermé sur
lui. Les choses qu'il perçoit ne seraient vraiment l'être que si j'apprenais qu'elles
sont vues par d'autres, qu'elles sont présomptivement visibles pour tout spectateur
qui mérite ce nom. L'en soi n'apparaîtra donc qu'après la constitution d'autrui.",signes.txt,
596,"Mais les démarches constitutives qui nous en séparent encore sont du même type
que le dévoilement de mon corps, elles usent, allons-nous voir, d'un universel qu'il
a déjà fait paraître. Ma main droite assistait à l'avènement du toucher actif dans
ma main gauche. Ce n'est pas autrement que le corps d’autrui s'anime devant moi,
quand je serre la main d'un autre homme ou quand seulement je la regarde 94 . En
apprenant que mon corps est « chose sentante », qu'il est excitable (reizbar), - lui,
et non pas seulement ma « conscience », - je me suis préparé à comprendre qu'il y
a d'autres animalia et possiblement d'autres hommes. Il faut bien voir qu'il n'y a là
ni comparaison, ni analogie, ni projection ou « introjection » 95 . Si, en serrant la
main de l'autre homme, j'ai l'évidence de son être-là, c'est qu'elle se substitue à ma
main gauche, que mon corps annexe le corps d'autrui dans cette « sorte de ré-
flexion » dont il est paradoxalement le siège. Mes deux mains sont « comprésen-
tes » ou « coexistent » parce qu'elles sont les mains d'un seul corps : autrui appa-
raît par extension de cette [213] Comprésence 96 , lui et moi sommes comme les
organes d'une seule intercorporéité. L'expérience d'autrui pour Husserl est d'abord
« esthésiologique » et elle doit l'être, si autrui existe effectivement, et non comme
le terme idéal, la quatrième proportionnelle qui viendrait compléter les rapports de
ma conscience avec mon corps objectif et avec le sien. Ce que je perçois d'abord,
c'est une autre « sensibilité » (Empfindbarkeit), et, à partir de là seulement, un
autre homme et une autre pensée. « Cet homme là-bas ; voit et entend ; sur la base
de ses perceptions, il porte tels et tels jugements, pose telles et telles évaluations
ou volitions, selon toutes les différentes formes possibles. Qu'« en » lui, dans cet
homme là-bas, un « je pense » surgisse, cela est un fait de nature (Naturfaktum)
fondé sur le corps et sur les événements corporels, déterminé par la connexion
causale et substantielle de la Nature (...) 97 . »",signes.txt,
597,"On demandera peut-être comment je peux étendre aux esprits la comprésence
des corps, et si ce n'est pas par un retour sur moi qui ramène la projection ou l'in-
trojection : n'est-ce pas en moi que j'apprends qu'une « Empfindbarkeit », des
champs sensoriels, présupposent une conscience ou un esprit ? Mais d'abord l'ob-


94   Ideen II, pp. 165-166.",signes.txt,
598,"95   Ibid., p. 166 : « ohne Introjektion »
96   Ideen II, « übertragene Kompräsenz »
97   Ibid., p. 181.",signes.txt,
599,"Maurice Merleau-Ponty, SIGNES. (1960)        168




jection postule qu'autrui peut être pour moi esprit exactement au sens ou je le suis
pour moi-même, et rien n'est moins sûr après tout : la pensée des autres n'est ja-
mais pour nous tout à fait une pensée. L'objection impliquerait en outre que le
problème est ici de constituer un autre esprit, alors que le constituant n'est lui-
même encore que chair animée ; rien n'empêche de réserver pour le moment où il
parlera et écoutera l'avènement d'un autre qui, lui aussi, parle et écoute. - Mais
surtout l'objection ignorerait cela même que Husserl a voulu dire : savoir, qu'il n'y
a pas constitution d'un esprit pour un esprit, mais d’un homme pour un homme.",signes.txt,
600,"Par l'effet d'une éloquence singulière du corps visible, l’Einfühlung va du corps à
l'esprit. Quand, par un premier « empiètement intentionnel » 98 , un autre corps
[214] explorateur, un autre comportement m'apparaît, c'est l'homme en bloc qui
m'est donné avec toutes les possibilités, quelles qu'elles soient, dont j'ai par-
devers moi, dans mon être incarné, l'irrécusable attestation. Jamais je ne pourrai
en toute rigueur penser la pensée de l'autre : je peux penser qu’il pense, construi-
re, derrière ce mannequin, une présence à soi sur le modèle de la mienne, mais
c'est encore moi que je mets en lui, c'est alors vraiment qu'il y a « introjection ».",signes.txt,
601,"Par contre, que cet homme là-bas voie, que mon monde sensible soit aussi le sien,
je le sais sans contredit, car j’assiste à sa vision, elle se voit dans la prise de ses
yeux sur le spectacle, et quand je dis : je vois qu'il voit, il n'y a plus là, comme
dans : je pense qu'il pense, emboîtement de deux propositions l'une dans l'autre,
vision « principale » et vision « subordonnée » se décentrent l'une l'autre. Une
forme était là qui me ressemble, mais occupée à des tâches secrètes, possédée par
un rêve inconnu. Soudain une lueur a paru un peu au-dessous et en avant des
yeux, le regard se lève et vient prendre les choses mêmes que je vois. Tout ce qui
de mon côté est appuyé sur l'animal de perceptions et de mouvements, tout ce que
je pourrai jamais construire sur lui, - et ma « pensée » aussi, mais comme modali-
sation de ma présence au monde, - tombe d'un seul coup dans l'autre. Je dis qu'il y
a là un homme, et non pas un mannequin, comme je vois que la table est là, et non
pas une perspective ou une apparence de la table. Il est vrai : je ne le reconnaîtrais
pas si je n'étais pas homme moi-même ; si je n'avais pas (ou ne croyais avoir avec
moi-même) le contact absolu de la pensée, un autre cogito ne surgirait pas devant
moi ; mais ces tables d'absence ne traduisent pas ce qui vient globalement de se
passer, elles notent des solidarités partielles qui dérivent de l'avènement d'autrui et
ne le constituent pas. Toute introjection présuppose ce qu'on voudrait expliquer
par elle. Si vraiment c'était ma « pensée » qu'il fallait mettre en autrui, je ne l'y
mettrais jamais : jamais aucune apparence n'aurait la vertu de me convaincre qu'il


98   « Intentionale Ueberschreiten. » L'expression est employée dans les Méditations Cartésien-
     nes.",signes.txt,
602,"Maurice Merleau-Ponty, SIGNES. (1960)    169




y a là-bas un cogito et ne pourrait motiver le transfert, quand toute la force
convaincante du mien tient à ce que je suis moi. Si autrui doit exister pour moi,
[215] il faut que ce soit d'abord au-dessous de l'ordre de la pensée. Ici, la chose est
possible, parce que l'ouverture perceptive au monde, dépossession plutôt que pos-
session, ne prétend pas au monopole de l'être, et n'institue pas la lutte à mort des
consciences. Mon monde perçue, les choses entr'ouvertes devant moi, ont, dans
leur épaisseur, de quoi fournir d'« états de conscience » plus d'un sujet sensible,
ils ont droit à bien d'autres témoins que moi. Qu'un comportement se dessine dans
ce monde qui me dépasse déjà, ce n'est là qu'une dimension de plus dans l'être
primordial, qui les comporte toutes. Dès la couche « solipsiste » donc, autrui n'est
pas impossible, parce que la chose sensible est ouverte. Il devient actuel quand un
autre comportement et un autre regard prennent possession de mes choses, et cela
même se fait, cette articulation sur mon monde d'une autre corporéité s'effectue
sans introjection, parce que mes sensibles, par leur aspect, leur configuration, leur
texture charnelle, réalisaient déjà le miracle de choses qui sont choses du fait
qu'elles sont offertes à un corps, faisaient de ma corporéité une épreuve de l’être.",signes.txt,
603,"L'homme peut faire l’alter ego que ne peut faire la « pensée » parce qu'il est hors
de soi dans le monde et qu'une ek-stase est compossible avec d'autres. Et cette
possibilité s'accomplit dans la perception comme vinculum de l'être brut et d'un
corps. Toute l'énigme de l'Einfühlung est dans sa phase initiale, « esthésiologi-
que », et elle y est résolue parce que c'est une perception. Celui qui « pose » l'au-
tre homme est sujet percevant, le corps de l'autre est chose perçue, l'autre lui-
même est « posé » comme « percevant ». Il ne s'agit jamais que de co-perception.",signes.txt,
604,"Je vois que cet homme là-bas voit, comme je touche ma main gauche en train de
toucher ma main droite.",signes.txt,
605,"Le problème de l’Einfühlung comme celui de mon incarnation débouche donc
sur la méditation du sensible, ou, si l'on préfère, il s’y transporte. Le fait est que le
sensible, qui s'annonce à moi dans ma vie la plus strictement privée, interpelle en
elle toute autre corporéité. Il est l’être qui m'atteint au plus secret, mais aussi que
j'atteins à l'état brut ou sauvage, dans un absolu de présence qui détient le secret
du monde, des autres et du vrai. Il y a là des [216] « objets » « qui ne sont pas
seulement présents originairement à un sujet, mais qui, s'ils le sont à un sujet,
peuvent idéalement être donnés en présence originaire à tous les autres sujets (dès
qu'ils sont constitués). La totalité des objets qui peuvent être présents originaire-
ment, et qui pour tous les sujets communicants constituent un domaine de présen-
ce originaire commune, est la Nature au sens premier et originaire 99 . » Nulle part
peut-être mieux que dans ces lignes ne se voit le double sens de la réflexion hus-

99    Ideen Il, p. 163.",signes.txt,
606,"Maurice Merleau-Ponty, SIGNES. (1960)   170




serlienne, analytique des essences et analytique des existences. Car c'est « idéale-
ment » (idealiter) que ce qui est donné à un sujet l'est par principe à tout autre,
mais c'est de la « présence originaire » du sensible que viennent l'évidence et
l'universalité qui sont véhiculées par ces rapports d'essence. Que l'on relise, si l'on
en doutait, les pages extraordinaires 100 où Husserl laisse entendre que, même si
l'on entendait poser l’être absolu ou vrai comme corrélatif d'un esprit absolu, il
aurait besoin, pour mériter son nom, d'avoir quelque rapport avec ce que nous
autres hommes appelons l’être, - que l'esprit absolu et nous devrions nous recon-
naître, comme deux hommes « ne peuvent qu'en se comprenant reconnaître que
les choses que l’un voit et celles que l'autre voit sont les mêmes » 101 , que donc
l’esprit absolu devrait voir les choses « à travers des apparences sensibles qui
puissent être échangées entre lui et nous dans un acte de compréhension récipro-
que, - ou au moins dans une communication à sens unique, - comme nos phéno-
mènes peuvent être échangés entre nous autres hommes », et qu’enfin « il devrait
avoir aussi un corps, ce qui ramènerait la dépendance à l'égard d'organes des
sens ». Certes, il y a plus de choses dans le monde et en nous que ce qui est sensi-
ble au sens restreint du mot. La vie même de l'autre ne m'est pas donnée avec son
comportement il faudrait, pour y avoir accès, que je fusse l'autre lui-même. Corré-
lativement, quelles que soient mes prétentions à saisir l'être même dans ce que je
perçois, je suis aux yeux de l'autre enfermé dans mes « représentations », je reste
en [217] deça de son monde sensible et le transcende donc. Mais c'est que nous
usons là d'une notion mutilée du sensible et de la Nature. Kant disait qu'elle est
« l'ensemble des objets des sens » 102 . Husserl retrouve le sensible comme forme
universelle de l'être brut. Le sensible, ce ne sont pas seulement les choses, c'est
aussi tout ce qui s'y dessine, même en creux, tout ce qui y laisse sa trace, tout ce
qui y figure, même à titre d'écart et comme une certaine absence : « Ce qui peut
être saisi par expérience au sens originaire du mot, l’être qui peut être donné en
présence originaire (das urpräsentierbare Sein) n'est pas tout l'être, et pas même
tout l’être dont il y a expérience. Les animalia sont des réalités qui ne peuvent
être données en présence originaire à plusieurs sujets : ils renferment des subjecti-
vités. Ce sont là des sortes d'objets très particuliers qui sont donnés originairement
de telle manière qu'ils présupposent des présences originaires sans pouvoir eux-
mêmes être donnés en présence originaire 103 . » Les animalia et les hommes sont
cela : des êtres absolument présents qui ont un sillage de négatif. Un corps perce-
vant que je vois, c'est aussi une certaine absence que son comportement creuse et

100   Ibid., p. 85.",signes.txt,
607,101   Ibid.,signes.txt,
608,"102   « Der Inbegriff der Gegenstände der Sinne. » (Krit. der Urteilskraft.)
103   Ideen II, p. 163.",signes.txt,
609,"Maurice Merleau-Ponty, SIGNES. (1960)           171




ménage derrière lui. Mais l'absence même est enracinée dans la présence, c'est par
son corps que l'âme d'autrui est âme à mes yeux. Les « négatités » comptent aussi
au monde sensible, qui est décidément l'universel.",signes.txt,
610,"*
                                               *       *",signes.txt,
611,"De tout cela, que résulte-t-il donc en ce qui concerne la constitution ? En pas-
sant à l'ordre pré-théorétique, préthétique ou préobjectif, Husserl a bouleversé les
rapports du constitué et du constituant. L’être en soi, l'être pour un esprit absolu
tire désormais sa vérité d'une « couche » où il n’y a ni esprit absolu, ni immanen-
ce des objets intentionnels à cet esprit, mais seulement des esprits incarnés qui
« appartiennent » par leur corps « au même [218] Monde » 104 . Cela ne veut, bien
entendu, pas dire que nous soyons passés de la philosophie à la psychologie ou à
l’anthropologie. Entre l’objectivité logique et l’intersubjectivité charnelle le rap-
port est un de ces rapports de Fundierung à double sens dont Husserl a parlé ail-
leurs. L’intercorporéité culmine (et se transforme) dans l’avènement des blosze
Sachen sans qu’on puisse dire que l’un des deux ordres soit premier par rapport à
l’autre. L’ordre du préobjectif n’est pas premier, puisqu’il ne se fixe et à vrai dire
ne commence tout à fait d’exister, qu’en s’accomplissant dans l’instauration de
l’objectivité logique ; celle-ci pourtant ne se suffit pas, elle se borne à consacrer le
travail de la couche préobjective, elle n’existe que comme aboutissement du
« Logos du monde esthétique » et ne vaut que sous son contrôle. Entre les cou-
ches « profondes » et les couches supérieures de la constitution, on devine le sin-
gulier rapport de Selbstvergessenheit que Husserl nomme déjà dans les
Ideen II 105 , et qu’il devait plus tard reprendre dans la théorie de la sédimentation.",signes.txt,
612,"L’objectivité logique dérive de l’intersubjectivité charnelle à condition qu’elle ait
été comme telle oubliée, et cet oubli, c’est elle-même qui le produit en cheminant
vers l’objectivité logique. Les forces du champ constitutif ne vont donc pas dans
un seul sens, elles se retournent contre elles-mêmes ; l’intercorporéité de dépasse
et finalement s’ignore comme intercorporéité, elle déplace et transforme sa situa-

104   Ideen II, p.82 : « L’objectivité logique est aussi, eo ipso, objectivité au sens de
      l’intersubjectivité. Ce qu’un connaisseur connaît en objectivité logique (…) tout connais-
      seur peut aussi le connaître, dans la mesure où il remplit les conditions auxquelles doit sa-
      tisfaire tout connaisseur de tels objets. Cela veut dire ici : il doit avoir l’expérience des cho-
      ses et des mêmes choses, il doit donc, pour être capable de reconnaître cette identité même,
      se trouver avec les autres connaisseurs dans une relation d’Einfühlung, et à cette fin, avoir
      une corporéité et appartenir au même monde (…) » (« zurselben Welt gehören »).",signes.txt,
613,"105   Ibid., p. 55.",signes.txt,
614,"Maurice Merleau-Ponty, SIGNES. (1960)   172




tion de départ, et le ressort de la constitution ne peut pas plus être trouvé dans son
début que dans son terme.",signes.txt,
615,"Ces rapports se retrouvent à chacun de ses degrés. La chose intuitive repose
sur le corps propre. Cela ne veut pas dire au sens des psychologues que la chose
soit faite [219] de kinesthèses. On peut aussi bien dire que tout le fonctionnement
du corps propre est suspendu à la chose intuitive sur laquelle se ferme le circuit du
comportement. Le corps n’est rien de moins, mais rien de plus que condition de
possibilité de la chose. Quand on va de lui à elle, on ne va ni du principe à la
conséquence, ni du moyen à la fin : on assiste à une sorte de propagation,
d’empiètement ou d’enjambement qui préfigure le passage du solus ipse à l’autre,
de la chose « solipsiste » à la chose intersubjective.",signes.txt,
616,"Car la chose « solipsiste » n’est pas première pour Husserl, ni le solus ipse. Le
solipsisme est une « expérience en pensée » 106 , le solus ipse un « sujet cons-
truit » 107 . Cette méthode de pensée isolante est destinée plutôt à révéler les liens
du tissu intentionnel qu’à les rompre. Si nous pouvions les rompre en réalité ou
seulement en pensée, couper vraiment le solus ipse des autres et de la Nature
(comme Husserl), avouons-le, l’a quelquefois fait, quand il imagine l’esprit
anéanti, puis la Nature anéantie et se demande ce qu’il en résulte pour la Nature et
pour l’esprit), dans ce fragment du tout, seul conservé, seraient conservés au
complet les références au tout dont il est fait : nous n’aurions toujours pas le solus
ipse. » (…) le solus ipse en réalité ne mérite pas son nom. L’abstraction que nous
avons accomplie parce qu’elle est justifiée intuitivement ne donne pas l’homme
isolé ou la personne humaine isolée. Elle ne consisterait d’ailleurs pas à préparer
un meurtre collectif des hommes et des animaux de notre entourage, où serait seul
épargné le sujet humain que je suis. Le sujet qui resterait seul dans ce cas serait
encore sujet humain, ce serait toujours l’objet intersubjectif se saisissant et se po-
sant toujours comme tel 108 . »",signes.txt,
617,"Cette remarque conduit loin. Dire que l’ego « avant » autrui est seul, c’est déjà
le situer par rapport à un fantôme d’autre, c’est au moins concevoir un entourage
où d’autres pourraient être. La vraie et transcendantale solitude n’est pas celle-là :
elle n’a lieu que si l’autre n’est [220] pas même concevable, et ceci exige qu'il n’y
ait pas non plus de moi pour la revendiquer. Nous ne sommes vraiment seuls qu'à
condition de ne pas le savoir, c'est cette ignorance même qui est notre solitude. La
« couche » ou la « sphère » dite solipsiste est sans ego et sans ipse. La solitude


106   « Gedankenexperiment », Ideen II, p. 81.",signes.txt,
618,"107   Ideen II, p. 81 : « Konstruiertes Subjekt. »
108   Ibid.",signes.txt,
