paragraph_id,text,source,vector
957,"ni l'américanisme n'ont à en attendre aucun bénéfice. Si nous en voulons à Ma-
lraux, à Kœstler, à Thierry Maulnier, à Burnham..., à la « ligue des espoirs per-
dus », aux « intellectuels en retraite », c'est précisément que, ayant ou vécu ou du
moins compris le marxisme, et rencontrant la question que nous posons, ils sont
retombés en deçà, ils n'ont pas tenté de tracer malgré tout un chemin pour l'huma-
nisme de tous les hommes, ils ont, chacun à sa manière, consenti au chaos, pris
leur retraite. Ils se sont dérobés à la tâche de tracer le programme minimum dont
parlait Trotsky. Trotsky et son parti ont posé la question [328] sous forme d'hypo-
thèse - et renvoyé à plus tard la réponse. Il ne faudrait pas que cette discussion
autour du faux testament se conclût purement et simplement par un exposé du
trotskysme classique. La tombe de Trotsky, s'il faut croire les photographies des
journaux, porte une faucille et un marteau, sans rien qui distingue cet emblème de
celui de l’U.R.S.S. Ainsi continue-t-il de s'affirmer solidaire des conquêtes d'Oc-
tobre. Mais cela, c'est le destin de Trotsky, c'est Trotsky concluant sa vie. Trotsky,
vivant encore dans ce qu'il a écrit, suggère une question à laquelle la pierre de sa
tombe ne répond pas. Ce serait notre affaire à tous d'y répondre.",signes.txt,
958,"(Juillet 1948.)
                                           Maurice Merleau-Ponty, SIGNES. (1960)    257",signes.txt,
959,II. Marxisme et superstition.,signes.txt,
960,Retour à la table des matières,signes.txt,
961,"Le marxisme a toujours admis que les valeurs de culture étaient, comme tout
le reste, solidaires de l'histoire sociale, mais n'a jamais admis que les deux déve-
loppements fussent point par point parallèles, ni donc la littérature et la critique de
simples auxiliaires de l'action politique, des variétés de la propagande. Engels
disait que la courbe des idéologies est beaucoup plus compliquée que celle de
l'évolution politique et sociale. Marx parle, dans un passage fameux, du « charme
éternel » de l'art grec. Il reconnaissait donc un registre de l'art (et sans doute de la
littérature) où étaient possibles des anticipations ou même des acquisitions « éter-
nelles ». C'était le communisme optimiste, qui fait confiance à la spontanéité de
l'écrivain ou de l'artiste, au développement intrinsèque de leur culture, et ne leur
donne d'autre consigne que d'être aussi profondément que possible écrivain ou
artiste, persuadé qu'il ne peut jamais y avoir de conflit, mais au contraire conver-
gence et rencontre, entre les exigences de la culture et l'action révolutionnaire. Le
communisme d'aujourd'hui se comporte au contraire comme s'il n'y avait plus de
critères intrinsèques en matière de culture, comme si littérature et science étaient
des moyens, parmi d'autres, de l'action politique [329] immédiate, elle-même
comprise comme simple défense de l'U.R.S.S.",signes.txt,
962,"En 1946, Lukacs, défendait sa conception de l'autocritique en termes de cultu-
re : c'était le droit, dont les écrivains, les philosophes et les savants ont toujours
usé, de dépasser ce qu'ils avaient précédemment dit ou écrit, de comprendre et de
juger leur propre passé, de mûrir et de grandir sans craindre les contradictions
apparentes, sans ce souci de rester formellement d'accord avec soi-même qui est
en réalité une prétention décadente : prétention de totaliser une œuvre avant qu'el-
le ait commencé, regard posthume sur une vie qu'on n'a pas encore vécue. Pour
tout dire, nous ne sommes pas sûr que cette théorie de l'autocritique pût justifier
les autocritiques que Lukacs pratiquait dès 1946 : nous avons peine à croire que,
de l'hégélianisme de Geschichte und Klassenbewusztsein à la théorie de la
connaissance réaliste des ouvrages récents, il y ait maturation, croissance. Mais
enfin la théorie du moins était saine. C'était en fait le droit de se tromper reconnu
à l'écrivain, les difficultés et même les ambiguïtés de l'expression et de la culture
réaffirmées d'une manière énergique. Et au contraire l'apparent libéralisme de
ceux qui défendaient contre Lukacs, ses premiers ouvrages n'était peut-être qu'une
manière rusée de l'enfermer dans son passé pré-marxiste.",signes.txt,
963,"Maurice Merleau-Ponty, SIGNES. (1960)           258",signes.txt,
964,"Aujourd'hui, il n'est plus question de rechercher, sur le terrain de l'histoire lit-
téraire, à quel moment le roman a atteint sa plus grande force d'expression, ou s'il
n'y a pas dans Tolstoï et dans Goethe un « charme éternel » qui fait d'eux des mo-
dèles. Les modèles sont tout trouvés : puisqu'il y a eu une révolution en Russie,
c'est en Russie que la littérature de l'avenir se dessine. La défense de l'U.R.S.S. est
aussi serrée sur le terrain du roman que sur celui de la diplomatie, elle n'est pas un
des devoirs révolutionnaires, elle est le seul. Le reste est occidentalisme. L'auto-
critique de Lukacs au sens de 1946 était un fait de culture. Au sens d'aujourd'hui,
elle en est la négation.",signes.txt,
965,"En 1937, Boukharine, reconsidérant son attitude des années passées dans la
perspective de la situation mondiale, se déclarait criminel pour avoir fait opposi-
tion, mais refusait de s'avouer espion ou saboteur. En 1949 Rajk, [330] contre tout
ce qu'on sait de lui, se donne pour un agent américain. En 1946 Lukacs revendi-
quait pour l'écrivain le droit de dépasser son passé, en 1949 il lui faut disqualifier
ses travaux de critique et d'esthéticien, comme si la haute estime où il tenait Tols-
toï et Goethe n'avait été qu'étourderie et précipitation. Ainsi le communisme passe
de la responsabilité historique à la discipline nue, de l'autocritique au reniement,
du marxisme à la superstition.",signes.txt,
966,(Décembre 1949.),signes.txt,
967,III. L'U.R.S.S. et les camps.,signes.txt,
968,"Il est donc établi que des citoyens soviétiques peuvent être déportés en cours
d'enquête, sans jugement et sans limite de temps. Le Code de travail correctif de
la R.F.S.S.R. 194 ne pose le principe de la décision administrative que pour le tra-
vail correctif sans suppression de la liberté 195 . Mais il la mentionne très claire-
ment en ce qui concerne la privation de liberté et la déportation, à l'article 44 196 .",signes.txt,
969,"194   Recueil chronologique des lois et décrets du Présidium du Soviet suprême et Ordonnances
      du gouvernement de la RFSSR au 1er mars 1940. Vol. 9, O.G.I.Z. (Union des maisons d'édi-
      tion d'État Gospolitizdat, 1941).",signes.txt,
970,"195   Section I du Code, article 8.",signes.txt,
971,"196   Article 44 de la Section II (Privation de la liberté). « Les personnes suivantes peuvent être
      envoyées dans les lieux de privation de liberté indiqués dans l'article 28 du présent code :
           a) Personnes condamnées pour une période n'excédant pas trois ans ;
           b) Personnes dont les cas sont à l'enquête ou en cours de procès par ordonnance des
      organismes compétents (souligné par nous) ;
           c) Personnes condamnées pour des périodes de plus de trois ans (...) »",signes.txt,
972,"Les lieux de privation de liberté mentionnés à l'article 28 sont en particulier : « a) les
      cellules de réclusion (...) ; b) les points de déportation ; c) les colonies de travail correctif,
                                                   Maurice Merleau-Ponty, SIGNES. (1960)           259




Il est donc impossible de soutenir, comme le [331] fait Pierre Daix 197 , que la
décision administrative n'est en vigueur que pour le cas bénin du travail correctif
sans privation de liberté.",signes.txt,
973,"Il est en outre établi que l'appareil répressif tend à constituer, en U.R.S.S., un
pouvoir distinct. Une ordonnance du 27 octobre 1934 198 transfère au N.K.V.D. la
direction et l'administration du travail correctif qui relevait jusque-là du Commis-
sariat du Peuple à la Justice. Le système a ses revenus propres, fournis par le tra-
vail des détenus, et qui servent en particulier à entretenir l'appareil administra-
tif 199 . La production est réglée par des plans industriels et financiers qui sont
dressés par le Directoire des institutions de travail correctif, et seulement ratifiés
par le Commissariat du Peuple à la Justice.",signes.txt,
974,"Il est troisièmement établi que la bonne marche du travail correctif est assurée
par une délégation de pouvoir aux détenus de droit commun 200 , - selon une mé-
thode qui a fait ses preuves.",signes.txt,
975,"Enfin, puisque des publications officielles font état de cent vingt-sept mille
détenus libérés par décision du gouvernement après l'achèvement du canal de la
Baltique à la Mer Blanche et du Canal de Moscou à la Volga, il est probable,
compte tenu du volume de ces chantiers dans l'ensemble de l'appareil, que le
nombre total des détenus se chiffre par millions : les uns disent dix millions, d'au-
tres quinze.",signes.txt,
976,[332],signes.txt,
977,"À moins d'être illuminé, on admettra que ces faits remettent entièrement en
question la signification du système russe. Nous n'appliquons pas ici à l'U.R.S.S.",signes.txt,
978,"les colonies industrielles, les colonies agricoles de travail en masse, les colonies pénitentiai-
       res » (article 28), auxquelles le même article ajoute des institutions sanitaires et des institu-
       tions pour mineurs privés de liberté.",signes.txt,
979,"Seules les personnes dont le cas est en cours d'enquête peuvent être maintenues dans
       les cellules de réclusion (art. 29). Mais elles n'y sont pas nécessairement maintenues. On les
       voit reparaître à l'article 31, qui concerne les points de déportation : « Les personnes privées
       de liberté, ou dont les cas sont en cours d'enquête, sont séparées des condamnés dans les
       points de déportation. » La réclusion en cellule n'est pas nécessairement suivie de comparu-
       tion devant un tribunal : « Les personnes ne sont gardées dans des cellules de réclusion que
       jusqu'à l'entrée en vigueur de la sentence du tribunal ou du décret des autres organismes
       compétents » (souligné par nous (article 29).",signes.txt,
980,197    Pourquoi D. Rousset a-t-il inventé les camps soviétiques ? p. 6.,signes.txt,
981,"198    Même Recueil, additif à l'article 129 du Code de travail correctif.",signes.txt,
982,"199    Même Recueil, Code de travail correctif, article 139 a.",signes.txt,
983,"200    Même Recueil, art. 87 du Code : « Au commandement de surveillance sont nommés les
       détenus les plus sûrs - les travailleurs - les personnes condamnées en première instance pour
       délits ordinaires. »
                                           Maurice Merleau-Ponty, SIGNES. (1960)   260




le principe de Péguy, qui disait que toute cité qui recèle une seule misère indivi-
duelle est une cité maudite : à ce compte, elles le sont toutes et il n'y aurait pas de
différence à faire entre elles. Ce que nous disons, c'est qu'il n'y a pas de socialis-
me quand un citoyen sur vingt est au camp. Rien ne sert de répondre ici que toute
révolution a ses traîtres, ou que la lutte des classes n'est pas finie avec l'insurrec-
tion, ou que l'U.R.S.S. ne pouvait se défendre contre l'ennemi du dehors en ména-
geant l'ennemi du dedans, ou que la Russie ne pouvait se mettre à la grande indus-
trie sans violence... Ces réponses ne sont pas valables s'il s'agit du vingtième de la
population - du dixième de la population mâle, - après un tiers de siècle. S'il y a
en U.R.S.S. un saboteur, un espion ou un paresseux pour vingt habitants, alors
que plus d'une épuration a déjà « assaini » le pays, s'il faut aujourd'hui « réédu-
quer » dix millions de citoyens soviétiques alors que les nourrissons d'octobre
1917 ont passé trente-deux ans, c'est que le système recrée lui-même et sans cesse
son opposition. S'il y a répression permanente, et si, loin de se résorber, l'appareil
répressif s’autonomise au contraire, c'est que le régime s'installe dans le déséqui-
libre, c'est que des forces productives sont étouffées par les formes de production.",signes.txt,
984,"Si les détenus de droit commun sont pour le régime des hommes plus sûrs que les
détenus politiques, c'est qu'il s'accommode mieux du « prolétariat de la canaille »
que des « prolétaires conscients ».",signes.txt,
985,"Si l'on est sérieux, on n'a plus alors qu'à regarder en face cette crise permanen-
te du régime russe : tient-elle au principe même de la production collective, ou
bien à la propriété d'État et au type de planification pratiqué en Russie ? Vient-
elle de la structure politique de l'U.R.S.S. et, dans cette hypothèse, ne concerne-t-
elle que la phase stalinienne, ou bien était-elle préformée dans l'organisation bol-
chevique du Parti, et, si on le croit, quelle autre formation politique peut-on
concevoir, quelles garanties inventer contre cette décadence ? Ces questions et
d'autres [333] ne peuvent pas être évitées. L'un de nous écrivait ici il y a deux ans
que la société soviétique est ambiguë et qu'on y trouve des signes de progrès et
des symptômes de régression. Si les concentrationnaires sont dix millions, - pen-
dant que, à l'autre extrémité de la hiérarchie soviétique, salaires et niveau de vie
sont quinze à vingt fois plus élevés que ceux des travailleurs libres, - alors la
quantité se change en qualité, c'est tout le système qui vire et change de sens, et,
malgré la nationalisation des moyens de production, bien que l'exploitation privée
de l'homme par l'homme et le chômage soient impossibles en U.R.S.S., on de-
mande quelles raisons nous avons encore de parler de socialisme à propos d'elle.",signes.txt,
986,"Telles sont les questions auxquelles l'extrême-gauche française et européenne
devrait se consacrer, - au lieu de donner son temps à des plaidoyers sans lende-
main : André Wurmser disant, il y a quelques mois : il n'y a pas de camps en Rus-
                                                 Maurice Merleau-Ponty, SIGNES. (1960)         261




sie ; Pierre Daix, il y a quelques semaines, que les camps sont « un des plus beaux
titres de gloire du régime soviétique 201 ».",signes.txt,
987,"*
                                             *       *",signes.txt,
988,"Oui, la question est toujours plus impérieuse : comment Octobre 1917 a-t-il pu
aboutir à la société cruellement hiérarchisée dont les traits peu à peu se précisent
sous nos yeux ? Dans Lénine, dans Trotsky et à plus forte raison dans Marx, pas
un mot qui ne soit sain, qui ne parle aujourd'hui encore aux hommes de tous les
pays, qui ne nous serve à comprendre ce qui se passe chez nous. Et, après tant de
lucidité, de sacrifice, d'intelligence, - les dix millions de déportés soviétiques, la
bêtise de la censure, la panique des justifications...",signes.txt,
989,"Si nos communistes veulent ignorer la question, leurs adversaires n'entendent
pas davantage la poser et rien dans ce qu'ils écrivent ne nous donne même un
commencement de réponse. Ce n'est pas y répondre que de parler de [334] névro-
se : à lire les témoignages d'anciens détenus, on ne trouve pas dans les camps so-
viétiques le sadisme, la religion de la mort, le nihilisme qui, - paradoxalement
joints à des intérêts précis, et tantôt d'accord, tantôt en lutte avec eux, - ont fini par
produire les camps d'extermination nazis. Ce n'est pas non plus répondre à notre
question que de mettre en cause la bureaucratie et ses intérêts propres : on ne voit
guère d'hommes qui se laissent conduire par l'intérêt seul, ils se fournissent tou-
jours de convictions. D'ailleurs, l'intérêt comme le sadisme se cachent mieux. On
ne remarque pas assez que le Code de travail correctif, présenté par le délégué
britannique à l'O.N.U., et par Rousset dans le Figaro Littéraire comme une révé-
lation, pouvait dès 1936 s'acheter dans sa version anglaise, chez Smith et Max-
well, éditeurs, Chancery Lane, à Londres, moyennant trois shillings six pence. La
libération de cent vingt-sept mille détenus a été annoncée officiellement à Mos-
cou 202 . Il paraît probable que l'évolution qui conduit d'Octobre 1917 aux dix mil-
lions d'esclaves, et qui, peu à peu, sous la permanence des formes ou des mots,
change le sens du système, s'est faite de proche en proche, sans vue délibérée, de
crise en crise, d'expédient en expédient, et que, dans sa signification sociale, elle
échappe à ses propres artisans. Dans l'alternative, chaque fois plus impérieuse, de

201   Pierre DAIX : Pourquoi David Rousset a-t-il inventé les camps soviétiques ? p. 12.",signes.txt,
990,"202   Un Allemand antinazi, qui avait déserté l'armée allemande pour rejoindre les Russes et fut
      employé par eux à des travaux forcés, nous disait que l'existence des camps et les très lour-
      des pertes annuelles étaient connues de la population dans la région de Léningrad.",signes.txt,
991,"Maurice Merleau-Ponty, SIGNES. (1960)   262




l'aggraver ou de disparaître politiquement, ils continuent, sans comprendre que
l'entreprise change sous leurs mains. Faute d'un fond sur lequel ils puissent la
voir, les meilleurs s'étonnent sans doute de ces cris de haine qui leur viennent du
monde capitaliste...",signes.txt,
992,"Regardons bien. Les formules du Code de travail correctif sont celles mêmes
d'un socialisme édénique - il ne s'agit plus de punir, il s'agit de rééduquer ; les
criminels sont des aveugles, il n'est que de les éclairer ; dans une société d'où l'ex-
ploitation est bannie, la paresse et la révolte sont des malentendus ; il faut mettre
l'asocial à [335] l'abri de la vertueuse colère du peuple unanime, en même temps
qu'on met le peuple à l'abri des entreprises de cet attardé ; le mieux est de le re-
mettre au travail, en lui expliquant avec une haute indulgence la grandeur de la
société nouvelle. Après quoi, apaisé et sauvé, il reprendra sa place dans l'œuvre
commune... Pensées du XIXe siècle, qui restent touchantes, et peut-être plus pro-
fondes qu'on ne croit, puisque après tout on n'a jamais réussi jusqu'ici à doter les
hommes, au départ, de chances vraiment comparables, puisqu'on ne les a jamais
tentés par le bien... Et voilà que ces idées de jeunesse se mettent à grimacer com-
me des vieillards, ces pensées innocentes deviennent le comble de la tartuferie et
de la ruse quand un citoyen sur vingt est détenu en leur nom, quand elles décorent
des camps où les hommes meurent de travail et de faim, quand elles couvrent la
répression d'une société durement inégale, quand, sous couleur de rééduquer les
égarés, il s'agit de briser les opposants, quand, sous prétexte d'autocritique, il
s'agit de reniement. Alors et d'un seul coup leur vertu se change en poison. Mais
cela n'est pas senti si clairement. À côté des cyniques et des pervers, qui se trou-
vent partout, sans doute bon nombre de jeunes héros soviétiques qui n'ont jamais
vécu dans un pays sans camps prennent sans ombre de scrupule le parti de la
bienséance. N'avons-nous jamais vu rien de pareil ? Beaucoup de fonctionnaires
bien doués et bien partis, - comme devait l'être Kravchenko dans sa première pé-
riode, - qui n'ont jamais connu, au sens de 1917, l'esprit critique et la discussion,
continuent de penser que les détenus sont des exaltés, des asociaux, des hommes
de mauvaise volonté, jusqu'au jour où le plaisir de vivre à New York leur donne
occasion de reconsidérer tout cela.",signes.txt,
993,"Quant aux survivants de 1917, ce, ne sont pas les meilleures têtes de l'huma-
nisme marxiste, ils ont toujours préféré l'empirisme à l'analyse des situations, ils
ont toujours cru beaucoup plus à l'appareil qu'aux mouvements des masses, ils ont
toujours mieux réussi comme organisateurs que comme orateurs populaires, ils se
sont toujours fiés à la manœuvre dans le Parti plutôt qu'à la prise de conscience.",signes.txt,
994,"Dans l'équation de Lénine, - les Soviets plus [336] l'électrification, - ils se sont
toujours intéressés de préférence au second terme. Alors, puisque l'U.R.S.S. élec-
                                            Maurice Merleau-Ponty, SIGNES. (1960)   263




trifie sans retomber au système du profit individuel, il doit leur sembler que l'es-
sentiel de la Révolution d'Octobre est sauvé. Il ne faut pas leur demander de re-
prendre Marx, de remarquer que, chez Marx, l'infrastructure, ce sont les forces
productives, en d'autres termes, non pas l’outillage seulement et les richesses pro-
duites, mais les hommes au travail, des hommes encore. Ils ne sont jamais entrés
dans ces subtilités, et leur matérialisme a toujours été bien peu dialectique... Et
puis, tout cela est si loin ; voilà bien longtemps qu'il a fallu en rabattre sur la
spontanéité des masses. Koestler, pensent-ils, a très bien expliqué cela : on ne fait
pas sa part au sentiment, si on lui donne quelque chose, il prend tout ; il ne faut
donc rien lui laisser. N'y pensons plus. Le canal de la Mer Blanche sera fait. Les
bases de la production collective seront affermies... Et les communistes du monde
entier attendent que, par une sorte d'émanation magique, tant de canaux, d'usines
et de richesses produisent un jour l'homme intégral, même s'il faut, pour les faire,
réduire en esclavage dix millions de Russes, réduire au désespoir leur famille, soit
encore vingt ou trente millions de Russes, former à l'art policier et à la dénoncia-
tion une autre partie de la population, à la servilité ou à l'égoïsme l'armée des
fonctionnaires. Voilà sans doute comment les meilleurs des communistes sont
sans oreilles pour dix millions de détenus.",signes.txt,
995,"*
                                        *       *",signes.txt,
996,"En regardant vers l'origine du système concentrationnaire, nous mesurons l'il-
lusion des communistes d'aujourd'hui. Mais c'est aussi cette illusion qui interdit de
confondre le communisme et le fascisme. Si nos communistes acceptent les
camps et l'oppression, c'est parce qu'ils en attendent la société sans classes par le
miracle des infrastructures. Ils se trompent, mais c'est ce qu'ils pensent. Ils ont le
tort de croire dans l'obscurité, mais c'est ce qu'ils croient. Les camps nazis por-
taient, eux aussi, les fameuses devises de rééducation par le travail, mais, à partir
du [337] moment où furent établies les chambres à gaz, personne ne pouvait croi-
re qu'il s'agît, même en intention, de rééduquer. Avant les chambres à gaz, les
camps allemands ont été calqués sur les camps russes et leurs devises pénitentiai-
res sur l'idéologie socialiste, exactement comme le Parti au sens fasciste a été cal-
qué sur le parti au sens bolchevik, et comme le fascisme a emprunté au bolche-
visme ridée de la propagande. Le fascisme est une angoisse devant le bolchevis-
me, dont il reprend la forme extérieure pour en détruire plus sûrement le contenu :
la Stimmung internationaliste et prolétarienne. Si l'on en conclut que le commu-
                                          Maurice Merleau-Ponty, SIGNES. (1960)   264




nisme est le fascisme, on comble après coup le vœu du fascisme, qui a toujours
été de masquer la crise capitaliste et l'inspiration humaine du marxisme. Jamais
nazi ne s'est encombré d'idées telles que : reconnaissance de l'homme par l'hom-
me, internationalisme, société sans classes. Il est vrai que ces idées ne trouvent
dans le communisme d'aujourd'hui qu'un porteur infidèle, et qu'elles lui servent de
décor plutôt que de moteur. Toujours est-il qu'elles y restent. Voilà ce qu'on en-
seigne à un jeune communiste russe ou français. Au lieu de quoi, la propagande
nazie enseignait à ses auditeurs l'orgueil du peuple allemand, l'orgueil des aryens
et le Führerprinzip.",signes.txt,
997,"Cela signifie que nous n'avons rien de commun avec un nazi et que nous
avons les mêmes valeurs qu'un communiste. Un communiste, dira-t-on, n'a pas de
valeurs. Il n’a que des fidélités. Nous répondons qu'il fait bien ce qu'il peut pour y
parvenir, mais que, grâce à Dieu, personne ne peut vivre sans respirer. Il a des
valeurs malgré lui. Nous pouvons penser qu'il les compromet en les incarnant
dans le communisme d'aujourd'hui. Encore est-il qu'elles sont nôtres, et qu'au
contraire nous n'avons rien de commun avec bon nombre d'adversaires du com-
munisme. Or ceci n'est pas affaire de sentiment. Nous voulons dire qu'à mesure
que, géographiquement et politiquement, nous nous éloignons de l'U.R.S.S., nous
trouvons des communistes qui sont toujours davantage des hommes comme nous,
et un mouvement communiste qui est sain. Si le sort nous faisait rencontrer l'un
des futurs Kravchenko qui doivent abonder en Russie, il y aurait sans doute fort
peu de fraternité : la [338] dégradation des valeurs marxistes est inévitable en
Russie même, les camps dissolvent l'illusion humaniste, les faits vécus chassent
les valeurs imaginées comme la mauvaise monnaie chasse la bonne. Mais quand
l'un de nous parle à un communiste martiniquais des affaires de la Martinique, il
se trouve sans cesse d'accord avec lui. Un lecteur du Monde écrivait dernièrement
à ce journal que toutes les déclarations sur les camps de travail soviétiques pou-
vaient bien être vraies, mais qu'enfin il était un ouvrier sans ressources et sans
logis et qu'il trouvait toujours plus d'appui auprès des communistes que des autres.",signes.txt,
