paragraph_id,text,source,vector
306,"Maurice Merleau-Ponty, SIGNES. (1960)           84




gage possible [106] dont elle détient le secret, - systèmes de signes liés à leur si-
gnification par des rapports univoques et susceptibles, dans leur structure comme
dans leur fonctionnement, d'une explicitation totale. Ainsi posé comme un objet
devant la pensée, le langage ne saurait à son égard jouer d'autre rôle que celui
d'accompagnement, substitut, aide-mémoire ou moyen secondaire de communica-
tion.",signes.txt,
307,"Par contre, dans des textes plus récents, le langage apparaît comme une ma-
nière originale de viser certains objets, comme le corps de la pensée (Formale und
transzendentale Logik 53 ) ou même comme l'opération par laquelle des pensées
qui, sans lui, resteraient phénomènes privés, acquièrent valeur intersubjective et
finalement existence idéale (Ursprung der Geometrie 54 2). La pensée philoso-
phique qui réfléchit sur le langage serait dès lors bénéficiaire du langage, enve-
loppée et située en lui. M. Pos (Phénoménologie et linguistique, Revue Internatio-
nale de philosophie, 1939) définit la phénoménologie du langage, non comme un
effort pour replacer les langues existantes dans le cadre d'une eidétique de tout
langage possible, c'est-à-dire pour les objectiver devant une conscience consti-
tuante universelle et intemporelle, mais comme retour au sujet parlant, à mon
contact avec la langue que je parle. Le savant, [107] l'observateur, voient le lan-
gage au passé. Ils considèrent la longue histoire d'une langue, avec tous les ha-
sards, tous les glissements de sens qui finalement ont fait d'elle ce qu'elle est au-
jourd'hui. Résultat de tant d'accidents, il devient incompréhensible que la langue
puisse signifier quoi que ce soit sans équivoque. Prenant le langage comme fait
accompli, résidu d'actes de signification passés, enregistrement de significations
déjà acquises, le savant manque inévitablement la clarté propre du parler, la fé-
condité de l'expression. Du point de vue phénoménologique, c'est-à-dire pour le

53   « Diese aber (sc. : die Meinung) liegt nicht äusserlich neben den Worten ; sondern redend
     vollziehen wir fortlaufend ein inneres, sich mit den Worten verschmelzendes, sie gleichsam
     beseelendes Meinen. Der Erfolg dieser Beseelung ist dass die Worte und die ganzen Reden
     ln sich eine Meignung gletchsam verleiblichen und verleiblicht in sich als Sinn tragen »
     (p. 20).",signes.txt,
308,"54   « Objektives Dasein ,in der Welt' das als solches zugänglich ist für jedermann kann aber die
     gelstige Objektivität des Sinngebildes letztlich nur haben vermöge der doppelschichtigen",signes.txt,
309,"Wiederholungen und vornehmlich der sinnlich verkörpernden. In der sinnlichen Verkör-
     pernden geschleht die ,Lokalisation' und Temporalisation' von Solchem das seinem Seins-
     sinn nach nicht-lokal und nicht-temporal ist... Wir fragen nun : .. Wie macht die sprachliche",signes.txt,
310,"Verleiblichung aus dem blosz innersubjektiven Gebilde, dem Gedanke, das objektive, das
     etwa als geometrischer Begriff oder Satz in der Tat für jedermann und in aller Zukunft vers-
     tändlich da ist ? Auf das Problem des Ursprunges der Sprache in ihrer idealen und durch",signes.txt,
311,"Aeusserung und Dokumentierung begründeten Existenz in der realen Welt wollen wir hier
     nicht elngehen, obschon wir uns bewusst sind, dass eine radikale Aufklärung der Seinsart
     der ,idealen Sinngebilde' hier ihren tiefsten Problemgrund haben musz » (Revue Internatio-
     nale de philosophie, 1939, p. 210).",signes.txt,
312,"Maurice Merleau-Ponty, SIGNES. (1960)    85




sujet parlant qui use de sa langue comme d'un moyen de communication avec une
communauté vivante, la langue retrouve son unité : elle n'est plus le résultat d'un
passé chaotique de faits linguistiques indépendants, mais un système dont tous les
éléments concourent à un effort d'expression unique tourné vers le présent ou
l'avenir, et donc gouverné par une logique actuelle.",signes.txt,
313,"Tels étant le point de départ et le point d'arrivée de Husserl en ce qui concerne
le langage, nous voudrions soumettre à la discussion quelques propositions tou-
chant d'abord le phénomène du langage, ensuite la conception de l'intersubjectivi-
té, de la rationalité et de la philosophie qui est impliquée par cette phénoménolo-
gie.",signes.txt,
314,II. Le phénomène du langage.,signes.txt,
315,I. La langue et la parole.,signes.txt,
316,Retour à la table des matières,signes.txt,
317,"Pouvons-nous simplement juxtaposer les deux perspectives sur le langage que
nous venons de distinguer, - le langage comme objet de pensée et le langage
comme mien ? C'est ce que faisait par exemple Saussure, quand il distinguait une
linguistique synchronique de la parole et une linguistique diachronique de la lan-
gue, irréductibles l'une à l'autre parce qu'une vue panchronique effacerait inévita-
blement l'originalité du présent. De même M. Pos se borne à décrire tour à tour
l'attitude objective et l'attitude phénoménologique sans se prononcer sur leur rap-
port. Mais on pourrait alors croire que la phénoménologie ne se distingue [108] de
la linguistique que comme la psychologie se distingue de la science du langage :
la phénoménologie ajouterait à la connaissance de la langue l'expérience de la
langue en nous, comme la pédagogie ajoute à la connaissance des concepts ma-
thématiques l'expérience de ce qu'ils deviennent dans l'esprit de ceux qui les ap-
prennent. L'expérience de la parole n'aurait alors rien à nous enseigner sur l’être
du langage, elle n'aurait pas de portée ontologique.",signes.txt,
318,"C'est ce qui est impossible. Dès qu'on distingue, à côté de la science objective
du langage, une phénoménologie de la parole, on met en route une dialectique par
laquelle les deux disciplines entrent en communication.",signes.txt,
319,"D'abord le point de vue « subjectif » enveloppe le point de vue « objectif » ; la
synchronie enveloppe la diachronie. Le passé du langage a commencé par être
                                          Maurice Merleau-Ponty, SIGNES. (1960)    86




présent, la série des faits linguistiques fortuits que la perspective objective met en
évidence s'est incorporée à un langage qui, à chaque moment, était un système
doué d'une logique interne. Si donc, considéré selon une coupe transversale, le
langage est système, il faut aussi qu'il le soit dans son développement. Saussure a
beau maintenir la dualité des perspectives, ses successeurs sont obligés de conce-
voir avec le schème sublinguistique (Gustave Guillaume) un principe médiateur.",signes.txt,
320,"Sous un autre rapport, la diachronie enveloppe la synchronie. Si, considéré se-
lon une coupe longitudinale, le langage comporte des hasards, il faut que le sys-
tème de la synchronie à chaque moment comporte des fissures où l'événement
brut puisse venir s'insérer.",signes.txt,
321,Une double tâche s'impose donc à nous.,signes.txt,
322,"a) Nous avons à trouver un sens dans le devenir du langage, à le concevoir
comme un équilibre en mouvement. Par exemple, certaines formes d'expression
entrant en décadence par le seul fait qu'elles ont été employées et ont perdu leur
« expressivité », on montrera comment les lacunes ou les zones de faiblesse ainsi
créées suscitent, de la part des sujets parlants qui veulent communiquer, une repri-
se des débris linguistiques laissés par le système en voie de régression et leur uti-
lisation selon un nouveau principe. [109] C'est ainsi que se conçoit dans la langue
un nouveau moyen d'expression et qu'une logique obstinée traverse les effets
d'usure et la volubilité même de la langue. C'est ainsi qu’au système d'expression
du latin, fondé sur la déclinaison et les changements flexionnels, s'est substitué le
système d'expression du français, fondé sur la préposition.",signes.txt,
323,"b) Mais, corrélativement, il nous faut comprendre que, la synchronie n'étant
qu'une coupe transversale sur la diachronie, le système qui est réalisé en elle n'est
jamais tout en acte, il comporte toujours des changements latents ou en incuba-
tion, il n'est jamais fait de significations absolument univoques qui puissent s'ex-
pliciter entièrement sous le regard d'une conscience constituante transparente. Il
s'agira, non d'un système de formes de signification clairement articulées l'une sur
l'autre, non d'un édifice d'idées linguistiques construit selon un plan rigoureux,
mais d'un ensemble de gestes linguistiques convergents dont chacun sera défini
moins par une signification que par une valeur d'emploi. Loin que les langues
particulières apparaissent comme la réalisation « brouillée » de certaines formes
de signification idéales et universelles, la possibilité d'une telle synthèse devient
problématique. L'universalité, si elle est atteinte, ne le sera pas par une langue
universelle qui, revenant en deçà de la diversité des langues, nous fournirait les
fondements de toute langue possible, mais par un passage oblique de telle langue
que je parle et qui m'initie au phénomène de l'expression à telle autre langue que
                                          Maurice Merleau-Ponty, SIGNES. (1960)    87




j'apprends à parler et qui pratique l'acte d'expression selon un tout autre style, les
deux langues, et finalement toutes les langues données, n'étant éventuellement
comparables qu'à l'arrivée et comme totalités, sans qu'on puisse y reconnaître les
éléments communs d'une structure catégoriale unique.",signes.txt,
324,"Loin donc qu'on puisse juxtaposer une psychologie du langage et une science
du langage en réservant à la première le langage au présent, à la seconde le langa-
ge au passé, le présent diffuse dans le passé, en tant qu'il a été présent, l'histoire
est l'histoire des synchronies successives, - et la contingence du passé linguistique
envahit jusqu’au système synchronique. Ce qui m'est enseigné par la phénoméno-
logie [110] du langage ce n'est pas seulement une curiosité psychologique : la
langue des linguistes en moi, avec les particularités que j'y ajoute, - c'est une nou-
velle conception de l'être du langage, qui est maintenant logique dans la contin-
gence, système orienté, et qui pourtant élabore toujours des hasards, reprise du
fortuit dans un totalité qui a un sens, logique incarnée.",signes.txt,
325,II. Quasi-corporéité du signifiant.,signes.txt,
326,"En revenant à la langue parlée ou vivante, nous découvrons que sa valeur ex-
pressive n'est pas la somme des valeurs expressives qui appartiendraient pour son
compte à chaque élément de la « chaîne verbale ». Au contraire, ils font système
dans la synchronie en ce sens que chacun d'eux ne signifie que sa différence à
l'égard des autres, - les signes, comme dit Saussure, sont essentiellement « diacri-
tiques » - et comme cela est vrai de tous, il n'y a dans la langue que des différen-
ces de signification. Si finalement elle veut dire et dit quelque chose, ce n'est pas
que chaque signe véhicule une signification qui lui appartiendrait, c'est qu'ils font
tous ensemble allusion à une signification toujours en sursis, quand on les consi-
dère un à un, et vers laquelle je les dépasse sans qu'ils la contiennent jamais. Cha-
cun d'eux n'exprime que par référence à un certain outillage mental, à un certain
aménagement de nos ustensiles culturels, et ils sont tous ensemble comme un
formulaire en blanc que l'on n'a pas encore rempli, comme les gestes d'autrui qui
visent et circonscrivent un objet du monde que je ne vois pas.",signes.txt,
327,"La puissance parlante que l'enfant s'assimile en apprenant sa langue n'est pas
la somme des significations morphologiques, syntaxiques et lexicales : ces
connaissances ne sont ni nécessaires ni suffisantes pour acquérir une langue, et
l'acte de parler, une fois acquis, ne suppose aucune comparaison entre ce que je
veux exprimer et l'arrangement notionnel des moyens d'expression que j'emploie.",signes.txt,
328,"Les mots, les tournures nécessaires pour conduire à l'expression mon intention
                                          Maurice Merleau-Ponty, SIGNES. (1960)   88




significative ne se recommandent à moi, quand je parle, que par ce que Humboldt
appelait [111] innere Sprachform (et que les modernes appellent Wortbegriff)
c’est-à-dire par un certain style de parole dont ils relèvent et selon lequel ils
s’organisent sans que j'aie besoin de me les représenter. Il y a une signification
« langagière » du langage qui accomplit la médiation entre mon intention encore
muette et les mots, de telle sorte que mes paroles me surprennent moi-même et
m'enseignent ma pensée. Les signes organisés ont leur-sens immanent, qui ne
relève pas du « je pense », mais du « je peux ».",signes.txt,
329,"Cette action à distance du langage, qui rejoint les significations sans les tou-
cher, cette éloquence qui les désigne de manière péremptoire, sans jamais les
changer en mots ni faire cesser le silence de la conscience, sont un cas éminent de
l'intentionnalité corporelle. J'ai une conscience rigoureuse de la portée de mes
gestes ou de la spatialité de mon corps qui me permet d'entretenir des rapports
avec le monde sans me représenter thématiquement les objets que je vais saisir ou
les rapports de grandeur entre mon corps et les cheminements que m'offre le
monde. À condition que je ne réfléchisse pas expressément sur lui, la conscience
que j'ai de mon corps est immédiatement significative d'un certain paysage autour
de moi, celle que j'ai de mes doigts d'un certain style fibreux ou grenu de l'objet.",signes.txt,
330,"C'est de la même manière que la parole, celle que je profère ou celle que j'entends,
est prégnante d'une signification qui est lisible dans la texture même du geste lin-
guistique, au point qu'une hésitation, une altération de la voix, le choix d'une cer-
taine syntaxe suffit à la modifier, et cependant jamais contenue en lui, toute ex-
pression m'apparaissant toujours comme une trace, nulle idée ne m'étant donnée
qu'en transparence, et tout effort pour fermer notre main sur la pensée qui habite
la parole ne laissant entre nos doigts qu’un peu de matériel verbal.",signes.txt,
331,III. Rapport du signifiant et du signifié. La sédimentation.,signes.txt,
332,"Si la parole est comparable à un geste, ce qu'elle est chargée d'exprimer sera
avec elle dans le même rapport que le but avec le geste qui le vise, et nos remar-
ques sur [112] le fonctionnement de l'appareil signifiant engageront déjà une cer-
taine théorie de la signification que la parole exprime. Ma visée corporelle des
objets de mon entourage est implicite, et ne suppose aucune thématisation, aucune
« représentation » de mon corps ni du milieu. La signification anime la parole
comme le monde anime mon corps : par une sourde présence qui éveille mes in-
tentions sans se déployer devant elles. L'intention significative en moi (comme
aussi chez l'auditeur qui la retrouve en m'entendant) n'est sur le moment, et même
                                          Maurice Merleau-Ponty, SIGNES. (1960)    89




si elle doit ensuite fructifier en « pensées » - qu'un vide déterminé, à combler par
des mots, - l'excès de ce que je veux dire sur ce qui est ou ce qui a été déjà dit.",signes.txt,
333,"Ceci signifie : a) que les significations de la parole sont toujours des idées au sens
kantien, les pôles d'un certain nombre d'actes d'expression convergents qui aiman-
tent le discours sans être proprement donnés pour leur compte ; b) que, par suite,
l'expression n'est jamais totale. Comme le remarque Saussure, nous avons le sen-
timent que notre langue exprime totalement. Mais ce n'est pas parce qu'elle ex-
prime totalement qu'elle est nôtre, c'est parce qu'elle est nôtre que nous croyons
qu'elle exprime totalement. « The man I love » est, pour un Anglais, une expres-
sion aussi complète que, pour un Français, « l'homme que j'aime ». Et « j'aime cet
homme » est, pour un Allemand qui peut par la déclinaison marquer expressément
la fonction du complément direct, une manière tout allusive de s'exprimer. Il y a
donc toujours du sous-entendu dans l'expression, - ou plutôt la notion de sous-
entendu est à rejeter : elle n'a un sens que si nous prenons pour modèle et pour
absolu de l'expression une langue (d'ordinaire la nôtre) qui, en fait, comme toutes
les autres, ne peut jamais nous conduire « comme par la main » jusqu'à la signifi-
cation, jusqu'aux choses mêmes. Ne disons donc pas que toute expression est im-
parfaite parce qu'elle sous-entend, disons que toute expression est parfaite dans la
mesure où elle est comprise sans équivoque et admettons comme fait fondamental
de l'expression un dépassement du signifiant par le signifié que c’est la vertu mê-
me du signifiant de rendre possible. c) que cet acte d'expression, cette jonction par
la transcendance du sens [113] linguistique de la parole et de la signification
qu'elle vise n'est pas pour nous, sujets parlants, une opération seconde, à laquelle
nous n'aurions recours que pour communiquer à autrui nos pensées, mais la prise
de possession par nous, l'acquisition de significations qui, autrement, ne nous sont
présentes que sourdement. Si la thématisation du signifié ne précède pas la parole,
c'est qu'elle en est le résultat. Insistons sur cette troisième conséquence.",signes.txt,
334,"Exprimer, pour le sujet parlant, c'est prendre conscience ; il n'exprime pas seu-
lement pour les autres, il exprime pour savoir lui-même ce qu'il vise. Si la parole
veut incarner une intention significative qui n'est qu’un certain vide, ce n'est pas
seulement pour recréer en autrui le même manque, la même privation, mais enco-
re pour savoir de quoi il y a manque et privation. Comment y parvient-elle ? L'in-
tention significative se donne un corps et se connaît elle-même en se cherchant un
équivalent dans le système des significations disponibles que représentent la lan-
gue que je parle et l'ensemble des écrits et de la culture dont je suis l'héritier. Il
s’agit, pour ce vœu muet qu'est l'intention significative, de réaliser un certain ar-
rangement des instruments déjà signifiants ou des significations déjà parlantes
(instruments morphologiques, syntaxiques, lexicaux, genres littéraires, types de
récit, modes de présentation de l'événement, etc.) qui suscite chez l'auditeur le
                                            Maurice Merleau-Ponty, SIGNES. (1960)     90




pressentiment d'une signification autre et neuve et inversement accomplisse chez
celui qui parle ou qui écrit 1’ancrage de la signification inédite dans les significa-
tions déjà disponibles. Mais pourquoi, comment, en quel sens, celles-ci sont-elles
disponibles ? Elles le sont devenues quand elles ont, en leur temps, été instituées
comme significations auxquelles je puis avoir recours, que j'ai - par une opération
expressive de même sorte. C'est donc celle-ci qu’il faut décrire si je veux com-
prendre la vertu de la parole. Je comprends ou crois comprendre les mots et les
formes du français ; j'ai une certaine expérience des modes d’expression littéraires
et philosophiques que m'offre la culture donnée. J’exprime lorsque, utilisant tous
ces instruments déjà parlants, je leur fais dire quelque chose qu'ils n'ont jamais dit.",signes.txt,
335,"Nous commençons à lire le philosophe en donnant aux mots qu'il emploie leur
[114] sens « commun », et, peu à peu, par un renversement d’abord insensible, sa
parole maîtrise son langage, et c’est l’emploi qu’il en fait qui finit par les affecter
d’une signification nouvelle et propre à lui. À ce moment, il s’est fait comprendre
et sa signification s’est installée en moi. On dit qu’une pensée est exprimée lors-
que les paroles convergentes qui la visent sont assez nombreuses et assez éloquen-
tes pour la désigner sans équivoque à moi, auteur, ou aux autres, et pour que nous
ayons tous l’expérience de sa présence charnelle dans la parole. Bien que seules
des Abschattungen de la signification soient thématiquement données, les fait est
que, passé un certain point de discours, les Abschattungen, prises dans son mou-
vement, hors duquel elles ne sont rien, se contractent soudain en une seule signifi-
cation, nous éprouvons que quelque chose a été dit, comme, au-dessus d’un mi-
nimum de messages sensoriels, nous percevons une chose, quoique l’explication
de la chose aille par principe à l’infini, – ou comme, spectacle d’un certain nom-
bre de conduites, nous en venons à percevoir quelqu’un quoique, devant la ré-
flexion, aucun autre que moi-même ne puisse être vraiment, et dans le même sens,
ego… Les conséquences de la parole, comme celles de la perception (et de la per-
ception d’autrui en particulier), passent toujours ses prémisses. Nous-mêmes qui
parlons ne savons pas nécessairement ce que nous exprimons mieux que ceux qui
nous écoutent. Je dis que je sais une idée lorsque s’est institué en moi le pouvoir
d’organiser autour d’elle des discours qui font sens cohérent, et ce pouvoir même
ne tient pas à ce que je la posséderais par devers moi et la contemplerais face à
face, mais à ce que j’ai acquis un certain style de pensée. Je dis qu’une significa-
tion est acquise et désormais disponible lorsque j’ai réussi à la faire habiter dans
un appareil de parole qui ne lui était pas d’abord destiné. Bien entendu, les élé-
ments de cet appareil expressif ne la contenaient pas réellement : la langue fran-
çaise, aussitôt instituée, ne contenait pas la littérature française, – il a fallu que je
les décentre et les recentre pour leur faire signifier cela que je visais. C’est préci-
sément cette « déformation cohérente » (A. Malraux) des significations disponi-
                                           Maurice Merleau-Ponty, SIGNES. (1960)     91




bles qui les [115] ordonne à un sens nouveau et fait franchir aux auditeurs, mais
aussi au sujet parlant, un pas décisif. Car désormais, les démarches préparatoires
de l’expression, – sont reprises dans le sens final de l’ensemble et se donnent
d’emblée comme dérivées de ce sens, maintenant installé dans la culture. Il sera
loisible au sujet parlant (et aux autres) d’aller droit au tout, il n’aura pas besoin de
réactiver tout le processus, il le possédera éminemment dans son résultat, une
tradition personnelle et interpersonnelle aura été fondée. Le Nachvollzug, délivré
des tâtonnements du Vollzug, en contracte les démarches dans une vue unique, il
y a sédimentation, et je pourrai penser au-delà. La parole, en tant que distincte de
la langue, est ce moment où l’intention significative encore muette et tout en acte
s’avère capable de s’incorporer à la culture, la mienne et celle d’autrui, de me
former et de le former en transformant le sens des instruments culturels. Elle de-
vient « disponible » à son tour parce qu’elle nous donne après coup l’illusion
qu’elle était contenue dans les significations déjà disponibles, alors que, par une
sorte de ruse, elle ne les a épousées que pour leur infuser une nouvelle vie.",signes.txt,
336,"III. Conséquences touchant
                         la philosophie phénoménologique.",signes.txt,
337,Retour à la table des matières,signes.txt,
338,"Quelle portée philosophique faut-il reconnaître à ces descriptions ? Le rapport
des analyses phénoménologiques et de la philosophie proprement dite n’est pas
clair. On les considère souvent comme préparatoires et Husserl lui-même a tou-
jours distingué les « recherches phénoménologiques » au sens large et la « philo-
sophie » qui devait les couronner. Cependant, il est difficile de soutenir que le
problème philosophique demeure entier après l’exploration phénoménologique du
Lebenswelt. Si, dans les écrits de Husserl, le retour au « monde vécu » est consi-
déré comme une première démarche absolument indispensable, c’est sans doute
qu’il n’est pas sans conséquences pour le travail [116] de constitution universelle
qui doit suivre, qu'à certains égards quelque chose demeure de la première démar-
che dans la seconde, qu'elle y est conservée de quelque manière, qu'elle n'est donc
jamais tout à fait dépassée et que la phénoménologie est déjà philosophie. Si le
sujet philosophique était une conscience constituante transparente devant laquelle
le monde et le langage fussent entièrement explicites comme ses significations et
ses objets, n'importe quelle expérience, phénoménologique ou non, suffirait à mo-
tiver le passage à la philosophie, et l'exploration systématique du Lebenswelt ne
serait pas nécessaire. Si le retour au Lebenswelt, et en particulier le retour du lan-
                                           Maurice Merleau-Ponty, SIGNES. (1960)    92




gage objectivé à la parole, est considéré comme absolument nécessaire, c'est que
la philosophie doit réfléchir sur le mode de présence de l'objet au sujet, la concep-
tion de l'objet et la conception du sujet tels qu'ils apparaissent à la révélation phé-
noménologique au lieu de leur substituer le rapport de l'objet au sujet tel qu'il est
conçu dans une philosophie idéaliste de la réflexion totale. Dès lors, la phénomé-
nologie est enveloppante par rapport à la philosophie, qui ne peut venir purement
et simplement s'ajouter à elle.",signes.txt,
